,index,title,pubDate,guid,link,description
227,621,Ukraine war: Jewish children airlifted to Israel,"Sat, 19 Mar 2022 00:01:22 GMT",https://www.bbc.co.uk/news/world-60785620,https://www.bbc.co.uk/news/world-60785620?at_medium=RSS&at_campaign=KARANGA,"In Israel, some 90 Ukrainian children have been dressing up for the joyful Jewish holiday of Purim."
228,9640,Politics increasingly a deal-breaker on US dating scene,"Tue, 25 Oct 2022 23:02:12 GMT",https://www.bbc.co.uk/news/world-us-canada-63180007,https://www.bbc.co.uk/news/world-us-canada-63180007?at_medium=RSS&at_campaign=KARANGA,"With US midterm elections looming, singles yearn more than ever to meet their ideological soulmate."
229,3978,Covid-19 in China: Shanghai getting used to 'new normal',"Wed, 08 Jun 2022 23:00:35 GMT",https://www.bbc.co.uk/news/world-asia-china-61659141,https://www.bbc.co.uk/news/world-asia-china-61659141?at_medium=RSS&at_campaign=KARANGA,"The city had been in lockdown for two months as China imposed its ""zero Covid"" policy on the population of 25m."
230,11978,Vietnam veteran wins lottery six times on intuition,"Fri, 23 Dec 2022 00:22:32 GMT",https://www.bbc.co.uk/news/world-us-canada-64042271,https://www.bbc.co.uk/news/world-us-canada-64042271?at_medium=RSS&at_campaign=KARANGA,"The Massachusetts man's head-scratching strategy nets him nearly $2m, plus 20 annual payments of $25,000."
231,15292,Council tax: What is it and how much is it rising?,"Thu, 30 Mar 2023 13:28:52 GMT",https://www.bbc.co.uk/news/uk-politics-55765504,https://www.bbc.co.uk/news/uk-politics-55765504?at_medium=RSS&at_campaign=KARANGA,Millions of households across the UK will see a sharp increase in council tax bills in April.
232,14189,"Alex Murdaugh trial: Power, privilege, murder and the downfall of a dynasty","Sun, 26 Feb 2023 02:05:51 GMT",https://www.bbc.co.uk/news/world-us-canada-64645725,https://www.bbc.co.uk/news/world-us-canada-64645725?at_medium=RSS&at_campaign=KARANGA,"Alex Murdaugh's trial for the killing of his wife and son has uncovered fraud, drug abuse and a suicide plot."
233,8106,Leicester City boss Brendan Rodgers vows 'to fight on' - but can he survive?,"Sat, 17 Sep 2022 21:14:44 GMT",https://www.bbc.co.uk/sport/football/62942133,https://www.bbc.co.uk/sport/football/62942133?at_medium=RSS&at_campaign=KARANGA,Will Brendan Rodgers keep his job at Leicester City after their 6-2 hammering at Tottenham?
234,12084,Edgware: Man arrested after woman dies in Christmas Day crash,"Sun, 25 Dec 2022 14:01:08 GMT",https://www.bbc.co.uk/news/uk-england-london-64090981,https://www.bbc.co.uk/news/uk-england-london-64090981?at_medium=RSS&at_campaign=KARANGA,The 22-year-old was in a car involved in a crash with a vehicle that had failed to stop for police.
235,5562,Sweden 5-0 Portugal: Man City's Filippa Angeldal scores two in easy win for Swedes,"Sun, 17 Jul 2022 19:14:38 GMT",https://www.bbc.co.uk/sport/football/62192401,https://www.bbc.co.uk/sport/football/62192401?at_medium=RSS&at_campaign=KARANGA,Ruthless Sweden score three times in the first half to march into the quarter-finals of Euro 2022 and end Portugal's interest in the tournament.
236,4305,Ukraine War: Russian Foreign Minister Sergei Lavrov fact-checked,"Thu, 16 Jun 2022 17:15:58 GMT",https://www.bbc.co.uk/news/61829953,https://www.bbc.co.uk/news/61829953?at_medium=RSS&at_campaign=KARANGA,Russia's foreign minister has been speaking to the BBC about the war in Ukraine.
237,10300,Dominic Raab faces questions over aggressive behaviour claims,"Sat, 12 Nov 2022 12:34:19 GMT",https://www.bbc.co.uk/news/uk-63607491,https://www.bbc.co.uk/news/uk-63607491?at_medium=RSS&at_campaign=KARANGA,A newspaper reports allegations Dominic Raab mistreated staff during a past stint as justice secretary.
238,7339,Pakistan floods: Map and before/after photos show extent of devastation,"Tue, 30 Aug 2022 20:55:02 GMT",https://www.bbc.co.uk/news/world-asia-62728678,https://www.bbc.co.uk/news/world-asia-62728678?at_medium=RSS&at_campaign=KARANGA,Satellite images and graphics reveal the scale of floods that have left millions homeless in Pakistan.
239,2707,Sri Lanka: The protests unifying a nation where ethnic fault lines run deep,"Sun, 08 May 2022 17:56:50 GMT",https://www.bbc.co.uk/news/world-asia-61373192,https://www.bbc.co.uk/news/world-asia-61373192?at_medium=RSS&at_campaign=KARANGA,Unprecedented protests in Colombo are unifying a nation where ethnic fault lines run deep.
240,8510,"Why is the US dollar so strong, and what does it mean?","Wed, 28 Sep 2022 08:44:49 GMT",https://www.bbc.co.uk/news/business-63040797,https://www.bbc.co.uk/news/business-63040797?at_medium=RSS&at_campaign=KARANGA,"The US dollar is at a 20-year high, and that affects businesses and households across the world."
241,13506,Disabled Shropshire man completes seven-day marathon feat,"Tue, 07 Feb 2023 10:55:14 GMT",https://www.bbc.co.uk/news/uk-england-shropshire-64513814,https://www.bbc.co.uk/news/uk-england-shropshire-64513814?at_medium=RSS&at_campaign=KARANGA,Darren Edwards has finished a gruelling seven global marathons in a week.
242,12100,Charlo-Tszyu off as undisputed world champion breaks hand,"Sun, 25 Dec 2022 15:31:02 GMT",https://www.bbc.co.uk/sport/boxing/64091245,https://www.bbc.co.uk/sport/boxing/64091245?at_medium=RSS&at_campaign=KARANGA,Jermell Charlo's bout with Tim Tszyu is postponed after the undisputed super-welterweight world champion breaks his hand in training.
243,14814,Leila Borrington: Woman jailed for killing three-year-old stepson,"Thu, 16 Mar 2023 16:56:58 GMT",https://www.bbc.co.uk/news/uk-england-nottinghamshire-64975538,https://www.bbc.co.uk/news/uk-england-nottinghamshire-64975538?at_medium=RSS&at_campaign=KARANGA,Harvey Borrington was non-verbally autistic and therefore could not tell of Leila Borrington's abuse.
244,14265,FA Cup 2023 highlights: Joao Palhinha and Manor Solomon score wonder goals as Fulham beat Leeds United,"Tue, 28 Feb 2023 22:13:03 GMT",https://www.bbc.co.uk/sport/av/football/64737577,https://www.bbc.co.uk/sport/av/football/64737577?at_medium=RSS&at_campaign=KARANGA,Watch highlights as Fulham score two spectacular goals to defeat Leeds 2-0 and reach the quarter-finals of the FA Cup for the first time since 2010.
245,2382,Alabama hunt for missing prison inmate and guard,"Mon, 02 May 2022 01:41:24 GMT",https://www.bbc.co.uk/news/world-us-canada-61294585,https://www.bbc.co.uk/news/world-us-canada-61294585?at_medium=RSS&at_campaign=KARANGA,"Charged with murder, officials warn the prisoner is considered ""armed and extremely dangerous""."
246,10112,Billie Jean King Cup Finals: Great Britain's 'underdogs' inspired in Glasgow by past experience,"Mon, 07 Nov 2022 17:49:22 GMT",https://www.bbc.co.uk/sport/tennis/63314399,https://www.bbc.co.uk/sport/tennis/63314399?at_medium=RSS&at_campaign=KARANGA,Great Britain's 'underdogs' are drawing on past success - and coffee and humour - to inspire them at the Billie Jean King Cup Finals in Glasgow.
247,1187,Liverpool boss Jurgen Klopp says planning for FA Cup semi-final 'ridiculous',"Fri, 01 Apr 2022 21:30:26 GMT",https://www.bbc.co.uk/sport/football/60961868,https://www.bbc.co.uk/sport/football/60961868?at_medium=RSS&at_campaign=KARANGA,"The Football Association's planning for the FA Cup semi-finals is ""one of the most ridiculous stories I ever heard"", says Liverpool manager Jurgen Klopp."
248,2101,Mariupol: Videos appear to show dead civilians,"Sat, 23 Apr 2022 15:24:26 GMT",https://www.bbc.co.uk/news/61187310,https://www.bbc.co.uk/news/61187310?at_medium=RSS&at_campaign=KARANGA,Footage has emerged of more than 20 civilians lying dead along a main road in the city of Mariupol.
249,4297,US Open: Rory McIlroy and England's Callum Tarren one behind leader Adam Hadwin,"Fri, 17 Jun 2022 00:22:11 GMT",https://www.bbc.co.uk/sport/golf/61833569,https://www.bbc.co.uk/sport/golf/61833569?at_medium=RSS&at_campaign=KARANGA,Rory McIlroy makes a strong start to the US Open to sit one shot behind first-round leader Adam Hadwin.
250,8181,MLS launches investigation after DC United forward Taxi Fountas accused of using racial slur,"Mon, 19 Sep 2022 17:35:41 GMT",https://www.bbc.co.uk/sport/football/62955035,https://www.bbc.co.uk/sport/football/62955035?at_medium=RSS&at_campaign=KARANGA,MLS launches an investigation into allegations that DC United forward Taxi Fountas directed a racial slur towards Inter Miami defender Damion Lowe.
251,1881,Match of the Day 2 analysis: How Bruno Guimaraes won the game for Newcastle,"Sun, 17 Apr 2022 23:00:11 GMT",https://www.bbc.co.uk/sport/av/football/61136987,https://www.bbc.co.uk/sport/av/football/61136987?at_medium=RSS&at_campaign=KARANGA,Match of the Day 2 pundits Stephen Warnock and Leon Osman praise Newcastle's matchwinner Bruno Guimaraes after their 2-1 win over Leicester.
252,13111,Reanne Evans beats Stuart Bingham to become first woman to win a match at Snooker Shoot Out,"Thu, 26 Jan 2023 22:50:48 GMT",https://www.bbc.co.uk/sport/snooker/64421226,https://www.bbc.co.uk/sport/snooker/64421226?at_medium=RSS&at_campaign=KARANGA,Reanne Evans beats former world champion Stuart Bingham 60-8 to become the first woman to win a match in the one-frame Snooker Shoot Out in Leicester.
253,244,Ukraine conflict: Growing numbers of firms pull back from Russia,"Fri, 11 Mar 2022 00:52:35 GMT",https://www.bbc.co.uk/news/business-60571133,https://www.bbc.co.uk/news/business-60571133?at_medium=RSS&at_campaign=KARANGA,Reputational risk and practical difficulties are making it harder to do business in the country.
254,6111,Oleksiy Vadatursky: Ukraine grain tycoon killed in Russian shelling of Mykolaiv,"Sun, 31 Jul 2022 22:20:40 GMT",https://www.bbc.co.uk/news/world-europe-62367356,https://www.bbc.co.uk/news/world-europe-62367356?at_medium=RSS&at_campaign=KARANGA,One of Ukraine's richest men and his wife died in a bombardment of the southern Mykolaiv of city.
255,9641,Tory members vent fury at Rishi Sunak’s coronation by MPs,"Tue, 25 Oct 2022 16:46:28 GMT",https://www.bbc.co.uk/news/uk-politics-63388010,https://www.bbc.co.uk/news/uk-politics-63388010?at_medium=RSS&at_campaign=KARANGA,Rishi Sunak's rise to Tory leader without a membership vote fuels discontent among the grassroots.
256,15196,Antonio Conte: Italian thanks Tottenham and fans for sharing 'passion' for football,"Mon, 27 Mar 2023 20:25:58 GMT",https://www.bbc.co.uk/sport/football/65094349,https://www.bbc.co.uk/sport/football/65094349?at_medium=RSS&at_campaign=KARANGA,"Antonio Conte has thanked Tottenham's fans for their ""support and appreciation"", adding he welcomed those at the club who shared his passion for football."
257,10187,Watch all the drama in 60 seconds,"Wed, 09 Nov 2022 15:05:12 GMT",https://www.bbc.co.uk/news/world-us-canada-63563189,https://www.bbc.co.uk/news/world-us-canada-63563189?at_medium=RSS&at_campaign=KARANGA,The moments you may have missed from around the US as ballots are counted and victors emerge.
258,93,Corrie Mckeague would binge-drink after friend's death - inquest,"Mon, 07 Mar 2022 13:51:51 GMT",https://www.bbc.co.uk/news/uk-england-suffolk-60647946,https://www.bbc.co.uk/news/uk-england-suffolk-60647946?at_medium=RSS&at_campaign=KARANGA,An inquest is being held after Corrie Mckeague vanished after a night out in Suffolk.
259,9331,British Gymnastics to name banned coaches in 'zero tolerance' plan on abuse,"Tue, 18 Oct 2022 15:01:40 GMT",https://www.bbc.co.uk/sport/gymnastics/63298671,https://www.bbc.co.uk/sport/gymnastics/63298671?at_medium=RSS&at_campaign=KARANGA,"British Gymnastics vows to put athlete welfare ahead of winning medals as it issues a 40-point action plan in response to ""systemic"" issues of abuse in the sport."
260,12473,Strike rules: What is a trade union and who is allowed to strike?,"Fri, 06 Jan 2023 10:56:59 GMT",https://www.bbc.co.uk/news/business-61950028,https://www.bbc.co.uk/news/business-61950028?at_medium=RSS&at_campaign=KARANGA,What are the rules on striking and do you have to be a trade union member to take part?
261,6456,Commonwealth Games: England's women beat Australia to win historic first hockey gold,"Sun, 07 Aug 2022 16:03:32 GMT",https://www.bbc.co.uk/sport/commonwealth-games/62457842,https://www.bbc.co.uk/sport/commonwealth-games/62457842?at_medium=RSS&at_campaign=KARANGA,England women's hockey team win Commonwealth Games gold for the first time with a 2-1 victory over four-time champions Australia.
262,5573,Worrying number of slim children dieting,"Mon, 18 Jul 2022 23:44:02 GMT",https://www.bbc.co.uk/news/health-62204770,https://www.bbc.co.uk/news/health-62204770?at_medium=RSS&at_campaign=KARANGA,"Slimming attempts have shot up and not just among those who are overweight, a study in England suggests."
263,12079,Wallasey pub shooting: Woman fatally shot was not targeted - police,"Sun, 25 Dec 2022 17:44:31 GMT",https://www.bbc.co.uk/news/uk-england-merseyside-64090038,https://www.bbc.co.uk/news/uk-england-merseyside-64090038?at_medium=RSS&at_campaign=KARANGA,The 26-year-old was shot in the head while celebrating Christmas with her sister and friends.
264,1112,Putin sets midnight deadline over rouble gas payments,"Thu, 31 Mar 2022 16:51:36 GMT",https://www.bbc.co.uk/news/business-60945248,https://www.bbc.co.uk/news/business-60945248?at_medium=RSS&at_campaign=KARANGA,"Vladimir Putin orders ""unfriendly"" foreign buyers of Russia's gas to open Russian bank accounts."
265,4979,Big Zuu on breaking the mould for cookery shows,"Mon, 04 Jul 2022 16:47:32 GMT",https://www.bbc.co.uk/news/entertainment-arts-61549423,https://www.bbc.co.uk/news/entertainment-arts-61549423?at_medium=RSS&at_campaign=KARANGA,TV cook Big Zuu reflects on his Dave show's double Bafta win and the importance of representation.
266,1906,Wayne Quilliam: Photographing the diversity of Aboriginal Australia,"Mon, 18 Apr 2022 16:18:26 GMT",https://www.bbc.co.uk/news/world-australia-61033360,https://www.bbc.co.uk/news/world-australia-61033360?at_medium=RSS&at_campaign=KARANGA,Australia has hundreds of Indigenous groups - and Wayne Quilliam is hoping to photograph them all.
267,8475,Tory MPs express concern over tax cuts as pound falls,"Mon, 26 Sep 2022 22:29:40 GMT",https://www.bbc.co.uk/news/uk-politics-63041869,https://www.bbc.co.uk/news/uk-politics-63041869?at_medium=RSS&at_campaign=KARANGA,"Some worry about the effect on the party's reputation, while others think market reaction will settle."
268,8225,War in Ukraine: Fact-checking Russian claims that Nato troops are fighting in Ukraine,"Wed, 21 Sep 2022 09:40:43 GMT",https://www.bbc.co.uk/news/62974506,https://www.bbc.co.uk/news/62974506?at_medium=RSS&at_campaign=KARANGA,President Putin has said Western military advisers are actively involved in Ukraine.
269,2877,NI Election 2022: Prime minister to visit NI as DUP blocks assembly,"Fri, 13 May 2022 17:55:33 GMT",https://www.bbc.co.uk/news/uk-northern-ireland-61427418,https://www.bbc.co.uk/news/uk-northern-ireland-61427418?at_medium=RSS&at_campaign=KARANGA,"The DUP's leader says the move shows his party is ""serious"" about resolving the NI Protocol."
270,13098,Court bid to protect tenants from rent-to-rent ‘ghost landlords’,"Thu, 26 Jan 2023 01:35:43 GMT",https://www.bbc.co.uk/news/uk-64378930,https://www.bbc.co.uk/news/uk-64378930?at_medium=RSS&at_campaign=KARANGA,It's hoped a ruling to define what a property landlord is will help tenants in some of England's worst homes.
271,7149,The Hundred: Are the boundaries in the women's competition too small?,"Wed, 24 Aug 2022 18:21:07 GMT",https://www.bbc.co.uk/sport/cricket/62637340,https://www.bbc.co.uk/sport/cricket/62637340?at_medium=RSS&at_campaign=KARANGA,We are seeing more sixes and higher scores in this year's women's Hundred - but is that because the boundaries are too small?
272,13406,Duhan van der Merwe scores sensational Six Nations try as Scotland beat England,"Sat, 04 Feb 2023 18:59:18 GMT",https://www.bbc.co.uk/sport/av/rugby-union/64525710,https://www.bbc.co.uk/sport/av/rugby-union/64525710?at_medium=RSS&at_campaign=KARANGA,"Watch Scotland winger Duhan van der Merwe score a ""sensational"" solo during their thrilling 29-23 Calcutta Cup victory against England in the Six Nations."
273,12961,RRR: Why the Indian action spectacle is charming the West,"Sat, 21 Jan 2023 01:07:58 GMT",https://www.bbc.co.uk/news/world-asia-india-64286680,https://www.bbc.co.uk/news/world-asia-india-64286680?at_medium=RSS&at_campaign=KARANGA,"The Telugu-language film has found unexpected success with US critics, the public and Hollywood stars."
274,926,John Lennon's son opens Yoko Ono performance centre in Liverpool,"Fri, 25 Mar 2022 17:23:02 GMT",https://www.bbc.co.uk/news/uk-england-merseyside-60875141,https://www.bbc.co.uk/news/uk-england-merseyside-60875141?at_medium=RSS&at_campaign=KARANGA,"Sean Lennon talks about his mother's ""great love for Liverpool"" as he opens a centre for live music."
275,1019,What is the background to Will Smith's attack?,"Mon, 28 Mar 2022 10:49:33 GMT",https://www.bbc.co.uk/news/entertainment-arts-60896604,https://www.bbc.co.uk/news/entertainment-arts-60896604?at_medium=RSS&at_campaign=KARANGA,The actor made headlines at the Oscars after hitting the comedian over a joke about his wife.
276,14065,Omagh police attack: John Caldwell 'has suffered life-changing injuries',"Thu, 23 Feb 2023 23:24:34 GMT",https://www.bbc.co.uk/news/uk-northern-ireland-64740066,https://www.bbc.co.uk/news/uk-northern-ireland-64740066?at_medium=RSS&at_campaign=KARANGA,Det Ch Insp John Caldwell is critically ill after being shot multiple times in Omagh.
277,6272,Pelosi visit: Taiwan puts the ball firmly in Xi Jinping's court,"Wed, 03 Aug 2022 05:24:26 GMT",https://www.bbc.co.uk/news/world-asia-62402935,https://www.bbc.co.uk/news/world-asia-62402935?at_medium=RSS&at_campaign=KARANGA,Nancy Pelosi's visit to Taipei has put an increasingly assertive China on the back foot.
278,11490,Eva Kaili: Senior EU lawmaker arrested over alleged bribery by Gulf state,"Sat, 10 Dec 2022 20:21:29 GMT",https://www.bbc.co.uk/news/world-europe-63921002,https://www.bbc.co.uk/news/world-europe-63921002?at_medium=RSS&at_campaign=KARANGA,Prosecutors suspect the country tried to influence European Parliament decisions using bribery.
279,5477,England v South Africa: Sophia Dunkley ton leads hosts to convincing win in second ODI,"Fri, 15 Jul 2022 19:47:56 GMT",https://www.bbc.co.uk/sport/cricket/62185338,https://www.bbc.co.uk/sport/cricket/62185338?at_medium=RSS&at_campaign=KARANGA,Sophia Dunkley hits her maiden international century as England beat South Africa by 114 runs in the second ODI in Bristol.
280,11103,Doctors raise safety fears at Birmingham hospitals,"Thu, 01 Dec 2022 22:32:32 GMT",https://www.bbc.co.uk/news/uk-england-63827648,https://www.bbc.co.uk/news/uk-england-63827648?at_medium=RSS&at_campaign=KARANGA,Whistleblowers allege they were punished for raising concerns at one of England's worst performing trusts.
281,13035,Energy saving scheme: What is the energy saving scheme for electricity?,"Tue, 24 Jan 2023 09:00:18 GMT",https://www.bbc.co.uk/news/business-64372264,https://www.bbc.co.uk/news/business-64372264?at_medium=RSS&at_campaign=KARANGA,A scheme to reward people for cutting back on electricity use is running for a second day.
282,6458,Commonwealth Games: Australia beat India by nine runs to claim cricket gold,"Sun, 07 Aug 2022 20:41:52 GMT",https://www.bbc.co.uk/sport/commonwealth-games/62458211,https://www.bbc.co.uk/sport/commonwealth-games/62458211?at_medium=RSS&at_campaign=KARANGA,Australia continue their dominance of women's cricket with a nine-run win over India at Edgbaston to secure Commonwealth Games gold.
283,7075,Man Utd 2-1 Liverpool: Ten Hag gets big calls right as Manchester United stun Liverpool,"Mon, 22 Aug 2022 22:37:30 GMT",https://www.bbc.co.uk/sport/football/62641019,https://www.bbc.co.uk/sport/football/62641019?at_medium=RSS&at_campaign=KARANGA,Manchester United manager Erik ten Hag shows courage of convictions as his side lift mood of crisis to beat Liverpool.
284,4258,Historic English pubs recognised for their interiors,"Wed, 15 Jun 2022 05:11:21 GMT",https://www.bbc.co.uk/news/uk-england-61797983,https://www.bbc.co.uk/news/uk-england-61797983?at_medium=RSS&at_campaign=KARANGA,"Historic England says the interiors help ""tell the fascinating story of pubs over the centuries""."
285,5845,Pope Francis apologises to indigenous people of Canada,"Mon, 25 Jul 2022 22:48:40 GMT",https://www.bbc.co.uk/news/world-us-canada-62300586,https://www.bbc.co.uk/news/world-us-canada-62300586?at_medium=RSS&at_campaign=KARANGA,Pope Francis apologies to the church-run residential school survivors on Canadian soil.
286,10202,Swingometer inventor Sir David Butler dies at 98,"Wed, 09 Nov 2022 09:51:25 GMT",https://www.bbc.co.uk/news/uk-politics-49979367,https://www.bbc.co.uk/news/uk-politics-49979367?at_medium=RSS&at_campaign=KARANGA,The veteran election night commentator co-invented the swingometer and pioneered exit polls.
287,14995,Met Police: The 'dark corner' of the force where Wayne Couzens worked,"Tue, 21 Mar 2023 15:10:21 GMT",https://www.bbc.co.uk/news/uk-65017475,https://www.bbc.co.uk/news/uk-65017475?at_medium=RSS&at_campaign=KARANGA,"Evidence painted a damning picture of two units, an insidious team, as described by one employee."
288,2771,Ukraine war: Boris Johnson visits Sweden and Finland,"Wed, 11 May 2022 01:21:22 GMT",https://www.bbc.co.uk/news/uk-61402292,https://www.bbc.co.uk/news/uk-61402292?at_medium=RSS&at_campaign=KARANGA,"Boris Johnson will meet the leaders of both nations, as they debate whether to join Nato."
289,3657,"Mountaineer JP Mohr's message: ""We can all reach our summits""","Tue, 31 May 2022 23:20:13 GMT",https://www.bbc.co.uk/news/world-latin-america-61562289,https://www.bbc.co.uk/news/world-latin-america-61562289?at_medium=RSS&at_campaign=KARANGA,Climber JP Mohr died on K2 but the foundation he created continues to inspire children in Chile.
290,14270,The deal at-a-glance,"Mon, 27 Feb 2023 19:50:01 GMT",https://www.bbc.co.uk/news/uk-politics-64790193,https://www.bbc.co.uk/news/uk-politics-64790193?at_medium=RSS&at_campaign=KARANGA,What does the new Windsor Framework agreement between the UK and the EU include?
291,8533,House of Zana owner hopes Zara trademark win will inspire others,"Thu, 29 Sep 2022 05:02:41 GMT",https://www.bbc.co.uk/news/uk-england-tees-62489485,https://www.bbc.co.uk/news/uk-england-tees-62489485?at_medium=RSS&at_campaign=KARANGA,Amber Kotrri says since her victory other businesses said they also received letters from Zara.
292,5810,Face to face with the bandit warlords of Nigeria,"Sun, 24 Jul 2022 23:25:46 GMT",https://www.bbc.co.uk/news/world-africa-62270540,https://www.bbc.co.uk/news/world-africa-62270540?at_medium=RSS&at_campaign=KARANGA,BBC Africa Eye has tracked down the ultra-violent bandit warlords who are raiding villages and abducting schoolchildren across north-western Nigeria.
293,1453,Bucha murders: German report says Russian troops discussed killings,"Thu, 07 Apr 2022 16:46:46 GMT",https://www.bbc.co.uk/news/world-europe-61028380,https://www.bbc.co.uk/news/world-europe-61028380?at_medium=RSS&at_campaign=KARANGA,"Intercepted audio appears to show Russians talking about shooting town residents, Der Spiegel says."
294,11109,Bruce Lehrmann: Australia parliament rape retrial abandoned,"Fri, 02 Dec 2022 00:29:06 GMT",https://www.bbc.co.uk/news/world-australia-63830015,https://www.bbc.co.uk/news/world-australia-63830015?at_medium=RSS&at_campaign=KARANGA,"A retrial of Bruce Lehrmann - who denies rape - would endanger his accuser's life, prosecutors say."
295,6152,Love Island: Ekin-Su and Davide crowned 2022 winners in live final,"Mon, 01 Aug 2022 22:25:29 GMT",https://www.bbc.co.uk/news/entertainment-arts-62380597,https://www.bbc.co.uk/news/entertainment-arts-62380597?at_medium=RSS&at_campaign=KARANGA,Laura Whitmore announced the winners of the ITV2 dating show during Monday's finale.
296,4818,England v South Africa: Issy Wong takes late wickets to boost hosts,"Wed, 29 Jun 2022 18:35:35 GMT",https://www.bbc.co.uk/sport/cricket/61960047,https://www.bbc.co.uk/sport/cricket/61960047?at_medium=RSS&at_campaign=KARANGA,Debutant Issy Wong takes two late wickets to aid England's push for victory over South Africa on day three of the one-off Test at Taunton.
297,3391,NBA Warriors coach on Texas school shooting: 'When are we going to do something?',"Wed, 25 May 2022 06:59:23 GMT",https://www.bbc.co.uk/news/world-us-canada-61576574,https://www.bbc.co.uk/news/world-us-canada-61576574?at_medium=RSS&at_campaign=KARANGA,Golden State Warriors' Steve Kerr condemns gun violence and refuses to answer basketball questions.
298,13546,Mary Queen of Scots: Deposed ruler's secret prison letters found and decoded,"Wed, 08 Feb 2023 12:10:18 GMT",https://www.bbc.co.uk/news/world-europe-64569883,https://www.bbc.co.uk/news/world-europe-64569883?at_medium=RSS&at_campaign=KARANGA,"The letters, written during her English captivity, were found during a trawl of French archives."
299,7447,Ukraine war: 'I'm more scared of my new teacher than of war',"Thu, 01 Sep 2022 00:17:19 GMT",https://www.bbc.co.uk/news/world-europe-62738150,https://www.bbc.co.uk/news/world-europe-62738150?at_medium=RSS&at_campaign=KARANGA,Children and parents share their concerns as just 40% of Ukrainian schools prepare to fully reopen.
300,10962,Big UK trial to find best drugs to fight flu,"Tue, 29 Nov 2022 00:28:31 GMT",https://www.bbc.co.uk/news/health-63783035,https://www.bbc.co.uk/news/health-63783035?at_medium=RSS&at_campaign=KARANGA,Covid scientists will be testing different medications to see what works against winter flu.
