,index,title,pubDate,guid,link,description
757,2879,Coleen Rooney: My online post was a last resort,"Fri, 13 May 2022 15:05:34 GMT",https://www.bbc.co.uk/news/entertainment-arts-61433801,https://www.bbc.co.uk/news/entertainment-arts-61433801?at_medium=RSS&at_campaign=KARANGA,"Mrs Rooney appeared in the witness box on day four of the libel case, brought by Rebekah Vardy."
758,2334,Why has Russia invaded Ukraine and what does Putin want?,"Fri, 29 Apr 2022 20:04:51 GMT",https://www.bbc.co.uk/news/world-europe-56720589,https://www.bbc.co.uk/news/world-europe-56720589?at_medium=RSS&at_campaign=KARANGA,"More than two months after Russia's leader unleashed war on Ukraine, there is no sign yet of when it will end."
759,5234,"Rae Morris: 'I was definitely, fully dropped'","Sat, 09 Jul 2022 23:54:43 GMT",https://www.bbc.co.uk/news/entertainment-arts-62068013,https://www.bbc.co.uk/news/entertainment-arts-62068013?at_medium=RSS&at_campaign=KARANGA,The left-field singer couldn't listen to music after her label dumped her. Here's how she recovered.
760,9582,General Election: When is the next one and could it be called sooner?,"Mon, 24 Oct 2022 13:25:05 GMT",https://www.bbc.co.uk/news/uk-politics-62064552,https://www.bbc.co.uk/news/uk-politics-62064552?at_medium=RSS&at_campaign=KARANGA,The decision to hold an early election usually rests with the prime minister.
761,3709,MLB: Texas Rangers' Eli White makes 'outrageous' catch to stop home run against Tampa Bay Rays,"Wed, 01 Jun 2022 10:47:13 GMT",https://www.bbc.co.uk/sport/av/baseball/61660772,https://www.bbc.co.uk/sport/av/baseball/61660772?at_medium=RSS&at_campaign=KARANGA,Watch as Eli White makes an incredible catch to prevent a home run during Texas Rangers' 3-0 win over Tampa Bay Rays.
762,4,Ukraine conflict: Oil price soars to highest level since 2008,"Mon, 07 Mar 2022 08:15:53 GMT",https://www.bbc.co.uk/news/business-60642786,https://www.bbc.co.uk/news/business-60642786?at_medium=RSS&at_campaign=KARANGA,Consumers are feeling the impact of higher energy costs as fuel prices and household bills jump.
763,5775,'Why I cut homeless people's hair for free',"Sat, 23 Jul 2022 23:17:15 GMT",https://www.bbc.co.uk/news/uk-england-nottinghamshire-62236868,https://www.bbc.co.uk/news/uk-england-nottinghamshire-62236868?at_medium=RSS&at_campaign=KARANGA,"Wisdom Oviawe, 22, has been offering his services to homeless people in Nottingham city centre."
764,13793,Nicola Sturgeon: Search begins to find successor,"Thu, 16 Feb 2023 00:45:20 GMT",https://www.bbc.co.uk/news/uk-scotland-64656166,https://www.bbc.co.uk/news/uk-scotland-64656166?at_medium=RSS&at_campaign=KARANGA,"After eight years as first minister, Ms Sturgeon says her head and her heart say it is the right time to go."
765,1674,My Job: 'I like breaking the prison officer stereotype',"Wed, 13 Apr 2022 00:54:00 GMT",https://www.bbc.co.uk/news/business-60993636,https://www.bbc.co.uk/news/business-60993636?at_medium=RSS&at_campaign=KARANGA,"Mica has been working at HMP Portland in Dorset, which houses over 500 prisoners, for five years."
766,10862,World Cup: England fans frustrated after disappointing USA match,"Fri, 25 Nov 2022 22:40:15 GMT",https://www.bbc.co.uk/news/uk-63761630,https://www.bbc.co.uk/news/uk-63761630?at_medium=RSS&at_campaign=KARANGA,The atmosphere was muted after fans took the day off work for what turned into a frustrating game.
767,6828,'The pinnacle of the quiz night',"Tue, 16 Aug 2022 14:34:07 GMT",https://www.bbc.co.uk/news/entertainment-arts-62561558,https://www.bbc.co.uk/news/entertainment-arts-62561558?at_medium=RSS&at_campaign=KARANGA,The news comes a year after he revealed he had been diagnosed with Parkinson's disease.
768,4202,Airlines told to cancel flights to stop travel chaos,"Tue, 14 Jun 2022 21:43:14 GMT",https://www.bbc.co.uk/news/business-61754664,https://www.bbc.co.uk/news/business-61754664?at_medium=RSS&at_campaign=KARANGA,Ministers says airlines must ensure summer schedules are deliverable to prevent more travel disruption.
769,3780,Introducing... Dr Ringo Starr,"Fri, 03 Jun 2022 08:12:34 GMT",https://www.bbc.co.uk/news/world-61680199,https://www.bbc.co.uk/news/world-61680199?at_medium=RSS&at_campaign=KARANGA,The Beatles drummer receives an honorary doctorate from the Berklee Academy of Music in Boston.
770,10348,Kherson: Inside the city liberated from the Russians,"Sun, 13 Nov 2022 11:50:35 GMT",https://www.bbc.co.uk/news/world-europe-63615008,https://www.bbc.co.uk/news/world-europe-63615008?at_medium=RSS&at_campaign=KARANGA,The BBC's Jeremy Bowen reports from the city newly liberated from Russian control.
771,4644,Roe v Wade: What is US Supreme Court ruling on abortion?,"Fri, 24 Jun 2022 15:40:44 GMT",https://www.bbc.co.uk/news/world-us-canada-54513499,https://www.bbc.co.uk/news/world-us-canada-54513499?at_medium=RSS&at_campaign=KARANGA,The US Supreme Court has overturned the landmark case which legalised abortion in 1973.
772,13870,Tyre Nichols: Ex-officers plead not guilty over his death,"Fri, 17 Feb 2023 16:31:40 GMT",https://www.bbc.co.uk/news/world-us-canada-64680815,https://www.bbc.co.uk/news/world-us-canada-64680815?at_medium=RSS&at_campaign=KARANGA,A judge confirms the five defendants are pleading not guilty to charges including murder and assault.
773,6357,'Bring me his head' - the spy sent to get Bin Laden,"Fri, 05 Aug 2022 15:45:42 GMT",https://www.bbc.co.uk/news/world-us-canada-62427462,https://www.bbc.co.uk/news/world-us-canada-62427462?at_medium=RSS&at_campaign=KARANGA,"Gary Schroen, one of the first Americans on the ground in Afghanistan after 9/11, has died aged 80."
774,1241,Just Stop Oil: More than 200 arrested after oil terminal protests,"Sun, 03 Apr 2022 14:26:22 GMT",https://www.bbc.co.uk/news/uk-england-coventry-warwickshire-60973447,https://www.bbc.co.uk/news/uk-england-coventry-warwickshire-60973447?at_medium=RSS&at_campaign=KARANGA,Protests at several sites around the Midlands and south of England enter a third day.
775,14448,Will Gadd: An ice climber's close-up view of climate change,"Tue, 07 Mar 2023 00:03:21 GMT",https://www.bbc.co.uk/sport/winter-sports/64839265,https://www.bbc.co.uk/sport/winter-sports/64839265?at_medium=RSS&at_campaign=KARANGA,"Ice is the glue that holds Will Gadd's sport together. As the world heats up, it is falling apart."
776,4929,Wimbledon 2022: Should Stefanos Tsitsipas have been disqualified for this?,"Sat, 02 Jul 2022 19:27:27 GMT",https://www.bbc.co.uk/sport/av/tennis/62024478,https://www.bbc.co.uk/sport/av/tennis/62024478?at_medium=RSS&at_campaign=KARANGA,Watch the controversial moment Greece's Stefanos Tsitsipas hits a ball into the crowd and the angry reaction from Nick Kyrgios as he argues that the fourth seed should have been disqualified.
777,1955,'Rare condition gives me TV static in my vision',"Wed, 20 Apr 2022 05:17:01 GMT",https://www.bbc.co.uk/news/uk-scotland-glasgow-west-60696867,https://www.bbc.co.uk/news/uk-scotland-glasgow-west-60696867?at_medium=RSS&at_campaign=KARANGA,A 19-year-old from South Lanarkshire has a little known condition which constantly affects her vision.
778,12799,Jurgen Klopp: Liverpool manager has no plans to quit 'unless someone tells me',"Mon, 16 Jan 2023 23:51:40 GMT",https://www.bbc.co.uk/sport/football/64299214,https://www.bbc.co.uk/sport/football/64299214?at_medium=RSS&at_campaign=KARANGA,"Liverpool manager Jurgen Klopp says he will not leave the club unless he is forced to, and hints at changes at Anfield during the summer."
779,1119,UK weather: Spring snow as parts of country hit by cold snap,"Thu, 31 Mar 2022 15:36:07 GMT",https://www.bbc.co.uk/news/uk-60941529,https://www.bbc.co.uk/news/uk-60941529?at_medium=RSS&at_campaign=KARANGA,"""Spring is on hold,"" says BBC Weather, in a sharp change to last week which saw highs of 20C."
780,3859,Ukraine war: Flight ban hits Russian foreign minister's visit to Serbia,"Sun, 05 Jun 2022 22:06:48 GMT",https://www.bbc.co.uk/news/world-europe-61698462,https://www.bbc.co.uk/news/world-europe-61698462?at_medium=RSS&at_campaign=KARANGA,"Balkan countries deny Sergei Lavrov's plane use of their airspace, scuppering his Serbia visit."
781,5097,Euro 2022: Beth Mead's goal gives England winning start against Austria,"Wed, 06 Jul 2022 21:38:51 GMT",https://www.bbc.co.uk/sport/av/football/62071591,https://www.bbc.co.uk/sport/av/football/62071591?at_medium=RSS&at_campaign=KARANGA,Watch highlights as England beat Austria in the opening match of the European Women's Championship.
782,7899,"Premier League: Chelsea-Liverpool, Man Utd-Leeds & Brighton-Palace off before Queen's funeral","Mon, 12 Sep 2022 18:23:10 GMT",https://www.bbc.co.uk/sport/football/62874403,https://www.bbc.co.uk/sport/football/62874403?at_medium=RSS&at_campaign=KARANGA,Chelsea's home game with Liverpool and Leeds United's trip to Manchester United have been postponed this weekend because of the funeral of Queen Elizabeth II.
783,6682,Latest UK weather forecast: Extreme heat to continue through weekend,"Fri, 12 Aug 2022 09:57:06 GMT",https://www.bbc.co.uk/news/uk-62518855,https://www.bbc.co.uk/news/uk-62518855?at_medium=RSS&at_campaign=KARANGA,Extreme temperatures could have an impact on health and transport.
784,1980,Mariupol: Satellite images suggest mass graves dug near besieged city,"Thu, 21 Apr 2022 18:43:22 GMT",https://www.bbc.co.uk/news/world-europe-61183056,https://www.bbc.co.uk/news/world-europe-61183056?at_medium=RSS&at_campaign=KARANGA,"Satellite images appear to show more than 200 graves, as Ukraine accuses Russia of mass killings."
785,10194,When will we know the results?,"Wed, 09 Nov 2022 09:02:03 GMT",https://www.bbc.co.uk/news/world-us-canada-63545194,https://www.bbc.co.uk/news/world-us-canada-63545194?at_medium=RSS&at_campaign=KARANGA,Officials have called on voters to be patient as the results of the 8 November midterm are certified.
786,7179,Four takeaways from this year's GCSE results,"Thu, 25 Aug 2022 13:20:33 GMT",https://www.bbc.co.uk/news/education-62647689,https://www.bbc.co.uk/news/education-62647689?at_medium=RSS&at_campaign=KARANGA,"Just like A-level students, these pupils experienced months of disruption during formative years."
787,5980,British Gas owner Centrica and Shell see profits soar as bills rise,"Thu, 28 Jul 2022 15:39:24 GMT",https://www.bbc.co.uk/news/business-62330190,https://www.bbc.co.uk/news/business-62330190?at_medium=RSS&at_campaign=KARANGA,"British Gas owner Centrica and Shell report huge profits, as UK households face even higher energy bills."
788,11263,World Cup 2022: England boss Gareth Southgate looking forward to 'acid test' against France,"Sun, 04 Dec 2022 23:13:42 GMT",https://www.bbc.co.uk/sport/football/63854309,https://www.bbc.co.uk/sport/football/63854309?at_medium=RSS&at_campaign=KARANGA,"England manager Gareth Southgate praised his side's ""ruthless"" display against Senegal that sets up an ""acid test"" game against defending champions France in the World Cup quarter-finals."
789,15023,Mesut Ozil: Five great Arsenal moments as ex-Real Madrid & Germany midfielder retires,"Wed, 22 Mar 2023 15:21:00 GMT",https://www.bbc.co.uk/sport/av/football/55698424,https://www.bbc.co.uk/sport/av/football/55698424?at_medium=RSS&at_campaign=KARANGA,"Watch five of Mesut Ozil's best moments for Arsenal as the former Real Madrid, Fenerbahce and Germany midfielder retires at 34."
790,1733,Marcus North pulls out of running to be England managing director of men's cricket,"Wed, 13 Apr 2022 13:58:34 GMT",https://www.bbc.co.uk/sport/cricket/61092159,https://www.bbc.co.uk/sport/cricket/61092159?at_medium=RSS&at_campaign=KARANGA,Former Australia batter Marcus North pulls out of the running to be England's new managing director of men's cricket for family reasons.
791,14594,Quiz of the week: Which cheese was in the news?,"Thu, 09 Mar 2023 17:39:32 GMT",https://www.bbc.co.uk/news/world-64901559,https://www.bbc.co.uk/news/world-64901559?at_medium=RSS&at_campaign=KARANGA,How closely have you been paying attention to what's been going on over the past seven days?
792,2602,Week in pictures: 30 April - 6 May 2022,"Fri, 06 May 2022 23:10:48 GMT",https://www.bbc.co.uk/news/in-pictures-61348541,https://www.bbc.co.uk/news/in-pictures-61348541?at_medium=RSS&at_campaign=KARANGA,"A selection of powerful images from all over the globe, taken in the past seven days."
793,1564,Man City v Liverpool: Premier League's top two meet at Etihad Stadium,"Sat, 09 Apr 2022 21:30:25 GMT",https://www.bbc.co.uk/sport/football/61027186,https://www.bbc.co.uk/sport/football/61027186?at_medium=RSS&at_campaign=KARANGA,The best two teams in England are preparing to meet on Sunday with just one point separating leaders Manchester City and second-placed Liverpool with eight games to go.
794,10104,US midterms: When will we know the election results?,"Mon, 07 Nov 2022 18:09:59 GMT",https://www.bbc.co.uk/news/world-us-canada-63545194,https://www.bbc.co.uk/news/world-us-canada-63545194?at_medium=RSS&at_campaign=KARANGA,Officials have called on voters to be patient as the results of the 8 November midterm are certified.
795,2686,NI secretary to meet Stormont political leaders ,"Sun, 08 May 2022 23:00:02 GMT",https://www.bbc.co.uk/news/uk-northern-ireland-61373504,https://www.bbc.co.uk/news/uk-northern-ireland-61373504?at_medium=RSS&at_campaign=KARANGA,"The secretary of state says Northern Ireland needs ""a stable and accountable government""."
796,14486,How many people cross the Channel in small boats and where do they come from?,"Tue, 07 Mar 2023 15:12:04 GMT",https://www.bbc.co.uk/news/uk-53699511,https://www.bbc.co.uk/news/uk-53699511?at_medium=RSS&at_campaign=KARANGA,The number of people claiming asylum in the UK rose sharply in 2022.
797,4800,The Papers: 'A new Iron Curtain' and '100m for the Royals?',"Wed, 29 Jun 2022 22:50:14 GMT",https://www.bbc.co.uk/news/blogs-the-papers-61990065,https://www.bbc.co.uk/news/blogs-the-papers-61990065?at_medium=RSS&at_campaign=KARANGA,More Nato troops in eastern Europe and a £15m rise in the Royal Family's grant feature in the papers.
798,4196,Grenfell Tower fire: How music helps young people cope,"Tue, 14 Jun 2022 00:22:20 GMT",https://www.bbc.co.uk/news/uk-england-london-61637613,https://www.bbc.co.uk/news/uk-england-london-61637613?at_medium=RSS&at_campaign=KARANGA,Kids on the Green was originally set up for young people as an emergency response to the 2017 disaster.
799,11876,Newspaper headlines: 'Ambulance strike threatens lives' and 'call a taxi',"Mon, 19 Dec 2022 23:34:53 GMT",https://www.bbc.co.uk/news/blogs-the-papers-64034598,https://www.bbc.co.uk/news/blogs-the-papers-64034598?at_medium=RSS&at_campaign=KARANGA,Strikes by ambulance service workers and nurses dominate the front pages on Tuesday.
800,7565,Liz Truss: What sort of prime minister will she be?,"Mon, 05 Sep 2022 21:38:12 GMT",https://www.bbc.co.uk/news/uk-politics-62798300,https://www.bbc.co.uk/news/uk-politics-62798300?at_medium=RSS&at_campaign=KARANGA,"Will Liz Truss be a pragmatist in Downing Street, or will she govern as a lady not for turning"
801,7028,Why are these Americans turning in (some of) their guns?,"Sun, 21 Aug 2022 23:01:02 GMT",https://www.bbc.co.uk/news/world-us-canada-62413112,https://www.bbc.co.uk/news/world-us-canada-62413112?at_medium=RSS&at_campaign=KARANGA,"When police in Texas offered to buy back unwanted firearms, gun owners of all kinds showed up."
802,4957,British Grand Prix: George Russell says Formula 1 needs to learn from Zhou Guanyu crash,"Sun, 03 Jul 2022 19:51:01 GMT",https://www.bbc.co.uk/sport/formula1/62031509,https://www.bbc.co.uk/sport/formula1/62031509?at_medium=RSS&at_campaign=KARANGA,George Russell says Formula 1 needs to learn lessons from the crash in which Zhou Guanyu's Alfa Romeo vaulted a barrier at Silverstone.
803,5567,Public sector pay: Millions of workers await deal decision,"Mon, 18 Jul 2022 23:47:16 GMT",https://www.bbc.co.uk/news/uk-politics-62206733,https://www.bbc.co.uk/news/uk-politics-62206733?at_medium=RSS&at_campaign=KARANGA,"NHS staff, teachers, police and the armed forces are to find out details of this year's wage rise."
804,12955,Chris Hipkins: Uphill battle looms for New Zealand's next PM,"Sat, 21 Jan 2023 09:56:52 GMT",https://www.bbc.co.uk/news/world-asia-64355972,https://www.bbc.co.uk/news/world-asia-64355972?at_medium=RSS&at_campaign=KARANGA,"The Labour party's popularity has slumped, but Jacinda Ardern is still a hard act to follow."
805,92,Scans reveal how Covid may change the brain,"Mon, 07 Mar 2022 16:00:06 GMT",https://www.bbc.co.uk/news/health-60591487,https://www.bbc.co.uk/news/health-60591487?at_medium=RSS&at_campaign=KARANGA,"Even after a mild infection, the overall size of the brain had shrunk, researchers found."
806,1388,Hydra: How German police dismantled Russian darknet site,"Tue, 05 Apr 2022 23:31:42 GMT",https://www.bbc.co.uk/news/technology-61002904,https://www.bbc.co.uk/news/technology-61002904?at_medium=RSS&at_campaign=KARANGA,German police say illegal sales on the site amounted to at least £1bn a year
807,11313,New chatbot has everyone talking to it,"Wed, 07 Dec 2022 00:14:31 GMT",https://www.bbc.co.uk/news/technology-63861322,https://www.bbc.co.uk/news/technology-63861322?at_medium=RSS&at_campaign=KARANGA,Open AI's ChatGPT generates convincing human-like answers in response to human prompts.
808,2137,Call for extra bank holiday to be made permanent,"Tue, 26 Apr 2022 02:13:24 GMT",https://www.bbc.co.uk/news/business-61219129,https://www.bbc.co.uk/news/business-61219129?at_medium=RSS&at_campaign=KARANGA,Dragons' Den star Deborah Meaden is among business leaders who signed an open letter to ministers.
809,10823,World Cup 2022: Iran performance 'won't be enough' v USA - Gareth Southgate,"Thu, 24 Nov 2022 13:47:17 GMT",https://www.bbc.co.uk/sport/av/football/63722464,https://www.bbc.co.uk/sport/av/football/63722464?at_medium=RSS&at_campaign=KARANGA,"Gareth Southgate tells Kelly Somers that England must raise their level further against the USA - and says certain decisions going against England are ""a concern""."
810,4479,"Disabled fans treated like animals, hearing told","Tue, 21 Jun 2022 19:49:44 GMT",https://www.bbc.co.uk/news/uk-england-merseyside-61872080,https://www.bbc.co.uk/news/uk-england-merseyside-61872080?at_medium=RSS&at_campaign=KARANGA,Liverpool supporters accuse the French interior minister of lying about the behaviour of English fans.
811,4242,Ambulance waits: 'Can you please tell them to hurry up or I shall be dead',"Wed, 15 Jun 2022 23:07:49 GMT",https://www.bbc.co.uk/news/health-61791151,https://www.bbc.co.uk/news/health-61791151?at_medium=RSS&at_campaign=KARANGA,"As the health safety watchdog warns on ambulance delays, the BBC investigates the case of 94-year-old Ken Shadbolt."
812,6611,Commonwealth Games takes big step towards esports,"Wed, 10 Aug 2022 23:01:54 GMT",https://www.bbc.co.uk/news/technology-62498889,https://www.bbc.co.uk/news/technology-62498889?at_medium=RSS&at_campaign=KARANGA,"Competitive gaming may soon be added to the Commonwealth Games programme, after a successful test event in Birmingham."
813,7900,England show the game is about glory in remarkable Test summer,"Mon, 12 Sep 2022 16:04:00 GMT",https://www.bbc.co.uk/sport/cricket/62872257,https://www.bbc.co.uk/sport/cricket/62872257?at_medium=RSS&at_campaign=KARANGA,"England won six of seven Tests this summer - but the glorious way they played the game was even more important, says chief cricket writer Stephan Shemilt."
814,2614,Sky walkway proposal for Edinburgh's Radical Road,"Fri, 06 May 2022 22:07:04 GMT",https://www.bbc.co.uk/news/uk-scotland-edinburgh-east-fife-61321634,https://www.bbc.co.uk/news/uk-scotland-edinburgh-east-fife-61321634?at_medium=RSS&at_campaign=KARANGA,It is one of the options being considered to tackle rock falls at the historic path in Edinburgh.
815,3770,Bavaria train crash: At least four killed in German rail accident,"Fri, 03 Jun 2022 21:03:56 GMT",https://www.bbc.co.uk/news/world-europe-61684048,https://www.bbc.co.uk/news/world-europe-61684048?at_medium=RSS&at_campaign=KARANGA,At least four people die and some 30 are injured after a train derails in the state of Bavaria.
816,14186,Secondary school places: When do parents find out?,"Thu, 23 Feb 2023 14:29:24 GMT",https://www.bbc.co.uk/news/education-64662613,https://www.bbc.co.uk/news/education-64662613?at_medium=RSS&at_campaign=KARANGA,Councils will soon be offering secondary school places to children in England and Wales.
817,11034,World Cup 2022: England 'step up' in Wales win and show frightening depth of Gareth Southgate's squad,"Tue, 29 Nov 2022 23:42:11 GMT",https://www.bbc.co.uk/sport/football/63803057,https://www.bbc.co.uk/sport/football/63803057?at_medium=RSS&at_campaign=KARANGA,Superb performances from Marcus Rashford and Phil Foden against Wales will give Gareth Southgate a selection headache for England.
818,11912,"The trip that transformed Australia and China ties, five decades on","Tue, 20 Dec 2022 17:21:35 GMT",https://www.bbc.co.uk/news/world-australia-63912368,https://www.bbc.co.uk/news/world-australia-63912368?at_medium=RSS&at_campaign=KARANGA,"Australia's first ambassador to China recounts a fascinating, high-stakes visit - and his unlikely place in it."
819,8428,Why a fall in the pound matters,"Mon, 26 Sep 2022 16:01:41 GMT",https://www.bbc.co.uk/news/business-49179234,https://www.bbc.co.uk/news/business-49179234?at_medium=RSS&at_campaign=KARANGA,Sterling fell to a record low after the UK government announced large tax cuts and borrowing.
820,9722,T20 World Cup: England coach Matthew Mott says side will not make widespread changes,"Thu, 27 Oct 2022 05:59:16 GMT",https://www.bbc.co.uk/sport/cricket/63408756,https://www.bbc.co.uk/sport/cricket/63408756?at_medium=RSS&at_campaign=KARANGA,"England will not ""throw the baby out with the bathwater"" in their crucial T20 World Cup match against Australia on Friday, says coach Matthew Mott."
821,7484,Bristol Zoo memories as 'major part' of city's life closes,"Fri, 02 Sep 2022 05:42:18 GMT",https://www.bbc.co.uk/news/uk-england-bristol-62753770,https://www.bbc.co.uk/news/uk-england-bristol-62753770?at_medium=RSS&at_campaign=KARANGA,"Bristol Zoo, known for its international conservation work, is closing after 186 years."
822,8441,Flu and Covid could make this a hard winter for UK,"Tue, 27 Sep 2022 23:12:26 GMT",https://www.bbc.co.uk/news/health-63045190,https://www.bbc.co.uk/news/health-63045190?at_medium=RSS&at_campaign=KARANGA,"People should prepare for a rampant flu season, say experts, based on what Australia has experienced."
823,3064,Turkey threatens to block Finland and Sweden Nato bids,"Tue, 17 May 2022 08:53:34 GMT",https://www.bbc.co.uk/news/world-europe-61472021,https://www.bbc.co.uk/news/world-europe-61472021?at_medium=RSS&at_campaign=KARANGA,Turkish President Erdogan accused the Nordic nations of harbouring terrorists wanted by Ankara.
824,13796,Epsom College deaths: Family tribute to head teacher and daughter,"Wed, 15 Feb 2023 18:15:06 GMT",https://www.bbc.co.uk/news/uk-england-surrey-64656326,https://www.bbc.co.uk/news/uk-england-surrey-64656326?at_medium=RSS&at_campaign=KARANGA,Emma Pattison and Lettie are believed to have been shot by George Pattison before he killed himself.
825,3512,Liverpool 0-1 Real Madrid: Reds beaten in Paris as Vinicius Jr hits winner,"Sat, 28 May 2022 22:14:36 GMT",https://www.bbc.co.uk/sport/football/61609200,https://www.bbc.co.uk/sport/football/61609200?at_medium=RSS&at_campaign=KARANGA,Liverpool's hopes of being crowned champions of Europe for a seventh time ends in heartbreak at the hands of Real Madrid in Paris.
826,9912,How much could your mortgage rise? Try our calculator,"Wed, 02 Nov 2022 14:25:54 GMT",https://www.bbc.co.uk/news/business-63474582,https://www.bbc.co.uk/news/business-63474582?at_medium=RSS&at_campaign=KARANGA,Use our calculator to find out how much mortgage payments could go up for your household.
827,1681,Grieving Russians can't believe talk of war crimes in Ukraine,"Tue, 12 Apr 2022 17:07:19 GMT",https://www.bbc.co.uk/news/world-europe-61073897,https://www.bbc.co.uk/news/world-europe-61073897?at_medium=RSS&at_campaign=KARANGA,"""They'll accuse Russia of anything,"" says the widow of a Russian soldier killed in Ukraine."
828,3404,Mohamed Salah: Liverpool forward will be at Anfield next season 'for sure',"Wed, 25 May 2022 15:51:14 GMT",https://www.bbc.co.uk/sport/football/61583621,https://www.bbc.co.uk/sport/football/61583621?at_medium=RSS&at_campaign=KARANGA,"Liverpool forward Mohamed Salah says he will be at Anfield next season ""for sure"" but does not confirm if he will sign a new deal."
829,11005,Leader of US far-right militia guilty of inciting rebellion,"Tue, 29 Nov 2022 23:49:01 GMT",https://www.bbc.co.uk/news/world-us-canada-63802649,https://www.bbc.co.uk/news/world-us-canada-63802649?at_medium=RSS&at_campaign=KARANGA,"Founder Stewart Rhodes and one other member, Kelly Meggs, were both found guilty on the rare charge."
830,14911,Taliban officials must sack sons given government jobs,"Sun, 19 Mar 2023 14:21:44 GMT",https://www.bbc.co.uk/news/world-asia-65005792,https://www.bbc.co.uk/news/world-asia-65005792?at_medium=RSS&at_campaign=KARANGA,Afghanistan's Islamist leader says officials should replace appointed sons or nephews and hire other workers.
831,15397,Andrew Tate: See luxury villa where brothers are under house arrest,"Sat, 01 Apr 2023 22:23:46 GMT",https://www.bbc.co.uk/news/world-europe-65150613,https://www.bbc.co.uk/news/world-europe-65150613?at_medium=RSS&at_campaign=KARANGA,The BBC's Lucy Williamson looks at the compound where Andrew Tate and brother Tristan are confined.
